{
  "schema_version": "1.0",
  "run_id": "2026-01-01T0000-acme",
  "verifier": "verify.mjs",
  "date": "2026-10-27",
  "rubric_version": "1.0.0",
  "audit_mode": "public",
  "result": "pass",
  "query_universe_hash": "sha256:f1e8f2e1817f87f64c6c07801b91315c0e51458eecf7496da8f060db92c93d6c",
  "checks": {
    "I1": true,
    "I2": true,
    "I3": true,
    "I4": true,
    "I5": true,
    "I6": true,
    "I7": true,
    "I8-I13": true,
    "I14": true,
    "I15": true,
    "I16": true,
    "I17": true,
    "I18": true,
    "I19": true,
    "I20": true,
    "I21": true,
    "I22": true,
    "I23": true,
    "I24": true,
    "I25": true,
    "I26": true,
    "I27": true,
    "I28": true,
    "I29": true,
    "I30": true,
    "I31": true,
    "I32": true,
    "I33": true,
    "I34": true,
    "I35": true,
    "I36": true,
    "I37": true,
    "I38": true,
    "I39": true,
    "I40": true
  },
  "hard_failures": [],
  "soft_failures": [],
  "mutation_tests": "pass",
  "mutations": [],
  "fixture": {
    "pass": true,
    "expected": {
      "display": 60,
      "band": "C",
      "total": 59.9
    },
    "actual": {
      "display": 60,
      "band": "C",
      "total": 59.9
    },
    "fixture": ".opencode/skills/home-service-local-visibility-audit/scripts/fixtures/acme-plumbing.audit.json"
  },
  "score": 60,
  "word_count": 1145,
  "waivers": []
}
